{
  "schema_version": "adk-phase-context-contract/v2",
  "identity_source": "manifest.json",
  "skill_semantics_source": "manifests/skill_content_contracts_v2.json",
  "domains": {
    "general": {
      "route": {
        "selectors": [
          {
            "kind": "selection-group",
            "selection_group": "runtime-routing",
            "include_runtime_roles": [
              "primary"
            ],
            "primary_cardinality": "exactly-one"
          }
        ],
        "resources": []
      },
      "propose": {
        "selectors": [
          {
            "kind": "skill",
            "skill": "adk-runtime-router",
            "expected_runtime_role": "primary"
          },
          {
            "kind": "selection-group",
            "selection_group": "requirements-intake",
            "include_runtime_roles": [
              "primary",
              "supporting"
            ],
            "primary_cardinality": "exactly-one"
          },
          {
            "kind": "selection-group",
            "selection_group": "architecture-documentation",
            "include_runtime_roles": [
              "primary"
            ],
            "primary_cardinality": "exactly-one"
          }
        ],
        "resources": []
      },
      "apply": {
        "selectors": [
          {
            "kind": "skill",
            "skill": "adk-code-simplification",
            "expected_runtime_role": "primary"
          },
          {
            "kind": "skill",
            "skill": "adk-unit-test-embedded",
            "expected_runtime_role": "primary"
          }
        ],
        "resources": []
      },
      "verify": {
        "selectors": [
          {
            "kind": "skill",
            "skill": "adk-test-strategy",
            "expected_runtime_role": "primary"
          },
          {
            "kind": "skill",
            "skill": "adk-artifact-gating",
            "expected_runtime_role": "governance"
          }
        ],
        "resources": []
      },
      "review": {
        "selectors": [
          {
            "kind": "selection-group",
            "selection_group": "code-review",
            "include_runtime_roles": [
              "primary",
              "supporting"
            ],
            "primary_cardinality": "exactly-one"
          }
        ],
        "resources": []
      }
    },
    "embedded": {
      "bsp-analysis": {
        "selectors": [
          {
            "kind": "selection-group",
            "selection_group": "bsp-analysis",
            "include_runtime_roles": [
              "primary"
            ],
            "primary_cardinality": "exactly-one"
          }
        ],
        "resources": [
          "knowledge/L2-domain/datasheets/"
        ]
      },
      "driver-development": {
        "selectors": [
          {
            "kind": "skill",
            "skill": "adk-driver-implementation",
            "expected_runtime_role": "primary"
          },
          {
            "kind": "selection-group",
            "selection_group": "driver-development",
            "include_runtime_roles": [
              "primary"
            ],
            "primary_cardinality": "exactly-one"
          },
          {
            "kind": "selection-group",
            "selection_group": "interrupt-dma",
            "include_runtime_roles": [
              "primary"
            ],
            "primary_cardinality": "exactly-one"
          }
        ],
        "resources": []
      },
      "debugging": {
        "selectors": [
          {
            "kind": "skill",
            "skill": "adk-systematic-debugging",
            "expected_runtime_role": "primary"
          },
          {
            "kind": "skill",
            "skill": "adk-embedded-remote-debug-log-triage",
            "expected_runtime_role": "primary"
          }
        ],
        "resources": [
          "knowledge/L2-domain/oops-patterns/"
        ]
      }
    }
  },
  "relationship_semantics_source": "manifests/skill_relationship_contracts_v2.json"
}
